{
  "architecture": "gpu",
  "name": "gpu-ids-getid-family-conformance",
  "program": "program.asm",
  "warp_config": "warps.json",
  "requires": ["gpu_ids"],
  "max_instructions": 100,
  "expect": {
    "halted": true,
    "error": false,
    "error_code": 0,
    "fault": null,
    "instructions_executed": 12,
    "warps": {
      "0": {
        "pc": 24,
        "active_mask": 0,
        "instructions_executed": 6,
        "registers": {
          "0": {"R1": 0, "R2": 0, "R3": 0, "R4": 7, "R5": "0x1000"},
          "3": {"R1": 3, "R2": 3, "R3": 0, "R4": 7, "R5": "0x1000"}
        }
      },
      "3": {
        "pc": 24,
        "active_mask": 0,
        "instructions_executed": 6,
        "registers": {
          "0": {"R1": 12, "R2": 0, "R3": 3, "R4": 2, "R5": "0x2000"},
          "1": {"R1": 13, "R2": 1, "R3": 3, "R4": 2, "R5": "0x2000"}
        }
      }
    }
  }
}
