{
  "architecture": "gpu",
  "requires": ["mul_div"],
  "name": "gpu-mandelbrot-packed",
  "program": "mandelbrot.asm",
  "warp_config": "warps.json",
  "max_instructions": 50000000,
  "timeout_seconds": 300,
  "expect": {
    "halted": true,
    "error": false,
    "error_code": 0,
    "memory_dumps": [
      {"address": "0x00004000", "file": "expected.bin"}
    ]
  }
}
