{
  "architecture": "cpu",
  "name": "calls-jalr-r0-is-jr",
  "program": "program.asm",
  "requires": ["calls"],
  "max_instructions": 20,
  "expect": {
    "halted": true,
    "error": false,
    "error_code": 0,
    "pc": "0x0000002C",
    "registers": {
      "R0": "0x00000000",
      "R2": "0x0000002A",
      "R3": "0x00000000",
      "R5": "0x0000002A",
      "R6": "0x00000000"
    }
  }
}
