{
  "name": "cpu-gpu/race/life-c",
  "architecture": "cpu",
  "build": {"command": ["make", "case"]},
  "program": "../../../../_build/c/life_app.bin",
  "max_instructions": 1000000,
  "timeout_seconds": 15,
  "requires": ["large_memory"],
  "expect": {
    "halted": true,
    "error": false,
    "pc": "0x0000000c",
    "memory_dumps": [
      {"address": "0x01080000", "file": "_build/expected-0.bin"},
      {"address": "0x01100000", "file": "_build/expected-1.bin"}
    ]
  }
}
