{
  "name": "cpu-gpu/race/rotate-c",
  "architecture": "cpu",
  "build": {"command": ["make", "case"]},
  "program": "../../../../_build/c/rotate_app.bin",
  "max_instructions": 1000000,
  "timeout_seconds": 15,
  "requires": ["gpu_core", "large_memory", "mul_div"],
  "expect": {
    "halted": true,
    "error": false,
    "pc": "0x0000000c",
    "memory_dumps": [
      {"address": "0x01100000", "file": "_build/expected-0.bin"}
    ]
  }
}
