{
  "name": "cpu-gpu/dma/rect",
  "architecture": "cpu",
  "program": "rect.asm",
  "requires": ["gpu_core", "calls", "large_memory"],
  "max_instructions": 1000000,
  "timeout_seconds": 15,
  "initial_memory": [
    {"address": "0x00020000", "file": "_build/guard.bin"},
    {"address": "0x00030000", "file": "_build/src1.bin"},
    {"address": "0x00040000", "file": "_build/guard.bin"},
    {"address": "0x00050000", "file": "_build/guard.bin"},
    {"address": "0x00060000", "file": "_build/src2.bin"},
    {"address": "0x00070000", "file": "_build/guard.bin"}
  ],
  "expect": {
    "halted": true,
    "error": false,
    "memory_dumps": [
      {"address": "0x00010000", "file": "_build/results.bin"},
      {"address": "0x00020000", "file": "_build/rect1.bin"},
      {"address": "0x00040000", "file": "_build/dst1.bin"},
      {"address": "0x00050000", "file": "_build/rect2.bin"},
      {"address": "0x00070000", "file": "_build/dst2.bin"}
    ]
  }
}
